z12gwldoxpvgjru4004cj3fxyvvvwffjqjg,1,2014-11-12T17:37:08,Ripazha Gaming,http://hackfbaccountlive.com/?ref=5242575﻿
z12usr54ppaxxf1dl23nhbybruapdnixw04,0,2014-11-12T20:12:47,Arthur Teixeira,I wanted to know the name of the guy that dances at 00:58 anybody knows ?﻿
z12svt0reqvqyppzw04cgt1axrqhddcbkfc,1,2014-11-12T20:21:27,derrick lawson,https://www.facebook.com/FUDAIRYQUEEN?pnref=story﻿
z13pitkr5prbgf3ja04cjjg4qme3txjpyqc0k,0,2014-11-12T23:56:54,Yeung Marvin,Haha its so funny to see the salt of westerners that top views of youtube  goes to video they dont even understand keep the salt up!﻿
z13aib0jgoiotfxxi04cj5lgulz3zdfrpew,1,2014-11-13T00:38:14,Stuart Mcdonald,FOLLOW MY COMPANY ON TWITTER  thanks.  https://twitter.com/TheWaxedHatCo﻿
z12oex5p1miewvugp04cgjfqiq3xsxrolhk,0,2014-11-13T00:58:20,Caius Ballad,imagine if this guy put adsense on with all these views... u could pay ur  morgage﻿
z13supiartrcdr4la22xc3aripu2x1z3a,1,2014-11-13T02:33:53,Ink Video Shorts,Hey come check us out were new on youtube let us know what you think and  don't forget to subscribe thanks.﻿
z12uthyi5vratjy0v22ycxxhgpuqs5te2,0,2014-11-13T06:33:21,Sigaraya Nesora,The girl in the train who was dancing her outfit was so fucking sexy but  the huge turn-off was she lacked eyebrows D:﻿
z131idupvn3yhf3mv23dwzhi4pqixvwuw,1,2014-11-13T07:59:33,Александр Федоров,Look at the pictures if not difficult http://image2you.ru/48051/1340524/        http://image2you.ru/48051/1340523/          http://image2you.ru/48051/1340522/ http://image2you.ru/48051/1340521/             http://image2you.ru/48051/1340520/       http://image2you.ru/48051/1340519/  http://image2you.ru/48051/1340518/            http://image2you.ru/48051/1340517/          http://image2you.ru/48051/1340504/ http://image2you.ru/48051/1340503/              http://image2you.ru/48051/1340502/            http://image2you.ru/48051/1340500/ http://image2you.ru/48051/1340499/        http://image2you.ru/48051/1340494/             http://image2you.ru/48051/1340493/ http://image2you.ru/48051/1340492/        http://image2you.ru/48051/1340491/           http://image2you.ru/48051/1340490/ http://image2you.ru/48051/1340489/             http://image2you.ru/48051/1340488/﻿
z12gcx5hzkayhbmve23ghd3plt2czf2rp04,0,2014-11-13T15:20:31,ArioseRose,Don't mind me I'm just checking what the views are up to : )﻿
z13qhxcb2ybzszosx22rh5hwhmmccpjx404,1,2014-11-13T15:47:27,The Silent Troll Defuser HD,Hey guys can you check my YouTube channel I know you hate comments like  this one but I promise if you check my videos it will be entertaining I do  Shotgun MontagesNinja Defuse Montages and Trolling please guys can you  check them out and thanks have a good day!!!!!!!﻿
z12yivpznrezu3gyf04ce11xdvmquxzjdo00k,0,2014-11-13T17:42:06,Tom Hosford,To everyone joking about how he hacked to get 2 billion views because  there's a certain amount of people or whatever  He actually did buy views.﻿
z13uud25otb0ird2h230chu54neyehsbg04,1,2014-11-13T21:48:26,Tofik Miedzyń,https://www.facebook.com/tofikmiedzynB/photos/a.1496273723978022.1073741828.1496241863981208/1498561870415874/?type=1&amp;theater ﻿
z12ozx4w5mytupefv23vvxdroqehuvbvv,1,2014-11-13T22:33:31,MrValentinique,https://www.facebook.com/eeccon/posts/733949243353321?comment_id=734237113324534&amp;offset=0&amp;total_comments=74   please like frigea marius gabriel comment :D﻿
z12vvnza4rq5tvzou04cgxeookraexq5opo0k,1,2014-11-13T23:02:09,Ghazi Rizvi,http://www.bing.com/explore/rewards?PUBL=REFERAFRIEND&amp;CREA=RAW&amp;rrid=_0f9fa8aa-243a-5c2f-c349-ede05ea397ca Bing rewards earn free money. AND NO U CANT GET UR VIRUS IN BLUE!﻿
z12exzcrvpeew1yxg04cd5tbwnmfubnh4kk0k,1,2014-11-14T00:01:37,Anthony1SV,Please do buy these new Christmas shirts! You can buy at any time before  December 4th and they are sold worldwide! Don't miss out:  http://teespring.com/treechristmas﻿
z13qyxk5tzq1e5asx22xjt3wdq3ns32f5,1,2014-11-14T11:50:02,Ameenk Chanel,Free my apps get 1m crdits ! Just click on the link and download a app and  done!! · Link: https://m.freemyapps.com/share/url/5af506e1﻿
z12uyzhazxqkzbrzz04cedqpkwzdvjyy3u40k,0,2014-11-14T12:21:52,Brandon Wilson,Why does a song like this have more views than Michael Jackson SMH﻿
z13sh3cz1kbqgrai504cf53qsq25ypmi5zs0k,0,2014-11-14T12:35:38,Leonel Hernandez, Something to dance to even if your sad JUST dance!!   PSY - GANGNAM STYLE (강남스타일) M/V: http://youtu.be/9bZkp7q19f0﻿
z12etrpq5xu0vnm2g230szo5ote3zviny,0,2014-11-14T13:16:24,InterGaming,everyones back lool this is almost 3 years old and people are still hear!  xD﻿
z13th1q4yzihf1bll23qxzpjeujterydj,0,2014-11-14T13:27:52,Carmen Racasanu,How can this have 2 billion views when there's only me on the planet? LOL﻿
z13fcn1wfpb5e51xe04chdxakpzgchyaxzo0k,0,2014-11-14T13:28:08,diego mogrovejo,I don't now why I'm watching this in 2014﻿
z130zd5b3titudkoe04ccbeohojxuzppvbg,1,2015-05-23T13:04:32,BlueYetiPlayz -Call Of Duty and More,subscribe to me for call of duty vids and give aways Goal-100 subs﻿
z12he50arvrkivl5u04cctawgxzkjfsjcc4,1,2015-06-05T14:14:48,Photo Editor,hi guys please my android photo editor download. thanks https://play.google.com/store/apps/details?id=com.butalabs.photo.editor﻿
z13vhvu54u3ewpp5h04ccb4zuoardrmjlyk0k,0,2015-06-05T18:05:16,Ray Benich,The first billion viewed this because they thought it was really cool the  other billion and a half came to see how stupid the first billion were...﻿
